<?xml version="1.0" encoding="UTF-8"?>
        <!ELEMENT categories (category*)>
        <!ELEMENT category (name, url)>
        <!ELEMENT name (#PCDATA)>
        <!ELEMENT url (#PCDATA)>